{
  "id": "6f0dca00-0000-4000-8000-000000000580",
  "schemaVersion": 8,
  "name": "Testy Charger (charging fixture, schema v8)",
  "rulesFamily": "srd-5.2.1",
  "level": 5,
  "classes": [
    { "class": { "contentId": "6f0dc000-0000-4000-8000-000000000080", "revisionId": "6f0de000-0000-4000-8000-000000000080" }, "level": 5 }
  ],
  "choices": [],
  "spells": [],
  "crossFamilyExceptions": [],
  "campaignExceptions": [],
  "baseAbilities": {
    "str": 12,
    "dex": 14,
    "con": 14,
    "int": 10,
    "wis": 12,
    "cha": 8
  },
  "pins": [
    { "contentId": "6f0dc000-0000-4000-8000-000000000080", "revisionId": "6f0de000-0000-4000-8000-000000000080" },
    { "contentId": "6f0dc000-0000-4000-8000-000000000081", "revisionId": "6f0de000-0000-4000-8000-000000000081" }
  ],
  "overrides": [],
  "play": {
    "temporaryHitPoints": 0,
    "resources": [],
    "conditions": [],
    "exhaustion": 0,
    "hitDiceSpent": [],
    "deathSaves": {
      "successes": 0,
      "failures": 0
    },
    "inspiration": false,
    "spellSlotsSpent": [],
    "pactSlotsSpent": 0,
    "toggles": []
  },
  "equipment": [],
  "currency": {
    "cp": 0,
    "sp": 0,
    "ep": 0,
    "gp": 0,
    "pp": 0
  },
  "notes": [],
  "updatedAt": "2026-10-24T00:00:00+00:00"
}
