{"id":"5f0dca00-0000-4000-8000-000000000051","schemaVersion":8,"name":"Testy Quickfoot (saved by 0.5.0)","rulesFamily":"srd-5.1","level":1,"classes":[],"choices":[],"spells":[],"crossFamilyExceptions":[],"campaignExceptions":[],"baseAbilities":{"str":10,"dex":14,"con":12,"int":10,"wis":13,"cha":8},"pins":[{"contentId":"5f0dc000-0000-4000-8000-000000000001","revisionId":"5f0de000-0000-4000-8000-000000000001"},{"contentId":"5f0dc000-0000-4000-8000-000000000003","revisionId":"5f0de000-0000-4000-8000-000000000003"},{"contentId":"5f0dc000-0000-4000-8000-000000000004","revisionId":"5f0de000-0000-4000-8000-000000000004"}],"overrides":[],"play":{"temporaryHitPoints":0,"resources":[],"conditions":[],"exhaustion":0,"hitDiceSpent":[],"deathSaves":{"successes":0,"failures":0},"inspiration":false,"spellSlotsSpent":[],"pactSlotsSpent":0,"toggles":[]},"equipment":[],"currency":{"cp":0,"sp":0,"ep":0,"gp":0,"pp":0},"notes":[],"updatedAt":"2026-09-24T12:00:00+00:00"}